ID,Name,Image,Url,Review count,Category,Rating,Price,Latitude,Longitude,Address,City,State,Country,Phone,Review
Jpxv-URBpIvcu0mE5B6S3g,Cafe Okawari,https://s3-media1.fl.yelpcdn.com/bphoto/3BUYpWqi8Z_7EqHynnX4gw/o.jpg,https://www.yelp.com/biz/cafe-okawari-san-francisco?adjust_creative=Sb39Q_neG8ncCfDxiJ2TWw&utm_campaign=yelp_api_v3&utm_medium=api_v3_business_search&utm_source=Sb39Q_neG8ncCfDxiJ2TWw,221,Japanese,4.5,$$,37.77826,-122.39388,236 Townsend St,San Francisco,CA,US,(415) 801-5927,"['Service was phenomenal despite coming on a down time. The gentleman at the register took the time and care to ask the chef if certain ingredients were in it...', 'Awesome place for hearty Japanese fare by Oracle Park. Thanks to their halal chicken supply, I got to try Chicken Katsu for the first time. It was crispy...', 'Casual meal spot located near Oracle Park/Caltrain station.\n\nOf course, I had to try the chicken katsu sando. The chicken was crispy and juicy with a nice...']"
kesgk8dCRyg3qRDYpuAKGg,Home Plate,https://s3-media3.fl.yelpcdn.com/bphoto/nJwasMq9L0cbh18dGhTw5A/o.jpg,https://www.yelp.com/biz/home-plate-san-francisco?adjust_creative=Sb39Q_neG8ncCfDxiJ2TWw&utm_campaign=yelp_api_v3&utm_medium=api_v3_business_search&utm_source=Sb39Q_neG8ncCfDxiJ2TWw,1433,Breakfast & Brunch,4.0,$$,37.79990506085279,-122.4371697,2150 Lombard St,San Francisco,CA,US,(415) 922-4663,"[""We waited 30 min for a waitress to get our order! Instead she took the order of a family that came like 20 min after we arrived. She didn't even said sorry..."", 'cute aesthetics, unique menu, great service :) \n\nwe got the honey avocado granola, crab cake benedict, and crispy french toast. everything was really good!...', ""This visit's was a lot more mediocre than my initial visit. The steak & eggs didn't have the chimichurri sauce from last time & the omelette was just decent...""]"
v3qnV929O7VFRVUB5hd72A,SF Chickenbox,https://s3-media3.fl.yelpcdn.com/bphoto/bCjLjqXiBr-h1NSwm_pCWg/o.jpg,https://www.yelp.com/biz/sf-chickenbox-san-francisco-2?adjust_creative=Sb39Q_neG8ncCfDxiJ2TWw&utm_campaign=yelp_api_v3&utm_medium=api_v3_business_search&utm_source=Sb39Q_neG8ncCfDxiJ2TWw,146,Chicken Shop,4.5,$$,37.79820548128758,-122.40491142651727,464 Broadway St,San Francisco,CA,US,(415) 509-9607,"['Big fan!! Really enjoyed the quantity and quality of the meal. \n\nSandwich was perfectly spicy, crispy, big and most importantly...tasty! Fries were also...', 'I work in the area and sadly, the before work eating options are limited. SF Chickenbox is the place I can always count on to deliver me a proper meal....', ""I can say that the bread is very good! It's so soft. The chicken itself is crispy, but thin. I would recommend the original more than the buffalo. I would...""]"
8dUaybEPHsZMgr1iKgqgMQ,Sotto Mare,https://s3-media3.fl.yelpcdn.com/bphoto/o3hIcGLMxV_5ynxEjGWGrw/o.jpg,https://www.yelp.com/biz/sotto-mare-san-francisco-4?adjust_creative=Sb39Q_neG8ncCfDxiJ2TWw&utm_campaign=yelp_api_v3&utm_medium=api_v3_business_search&utm_source=Sb39Q_neG8ncCfDxiJ2TWw,4508,Seafood,4.5,$$,37.79979,-122.40834,552 Green St,San Francisco,CA,US,(415) 398-3181,"['A perfect place and flavor!\nI seated on bar table and everythings are good.\nI will come again next year.', 'Cute atmosphere and amazing food!! The scallops were some of the best that we had ever had', ""Excellent food, we split the wedge salad and cioppino, and it was a ton of food, we didn't finish the cioppino. Amount of seafood in it was awesome, it...""]"
oxIccYsvTXBOxWvK9GdTsA,Turner's Kitchen,https://s3-media3.fl.yelpcdn.com/bphoto/yab-3fQdA0_gnRMzyQPpog/o.jpg,https://www.yelp.com/biz/turners-kitchen-san-francisco?adjust_creative=Sb39Q_neG8ncCfDxiJ2TWw&utm_campaign=yelp_api_v3&utm_medium=api_v3_business_search&utm_source=Sb39Q_neG8ncCfDxiJ2TWw,384,Sandwiches,4.5,$$,37.763082,-122.424349,3505 17th St,San Francisco,CA,US,(415) 621-3505,"['Same quality and portion of Deli board, half of the price. Such a hidden gem in the mission. Very unassuming and the best flavors', ""I was on a sandwich kick earlier in the year, and Turner's was on the top of my list to check out given all the press and glowing reviews. They actually..."", 'My partner and I both got the Sofi Tukker. Well, it was clear there were ingredients missing: neither of ours had the peanuts, plantains, mint, lime or...']"
