ID,Name,Image,Url,Review count,Category,Rating,Price,Latitude,Longitude,Address,City,State,Country,Phone,Review
EywuPThEPY-BqhSV9UsvRg,Cracked & Battered - Marina,https://s3-media4.fl.yelpcdn.com/bphoto/9CsE2NVVsjm8559kQCMxMw/o.jpg,https://www.yelp.com/biz/cracked-and-battered-marina-san-francisco?adjust_creative=Sb39Q_neG8ncCfDxiJ2TWw&utm_campaign=yelp_api_v3&utm_medium=api_v3_business_search&utm_source=Sb39Q_neG8ncCfDxiJ2TWw,345,Breakfast & Brunch,4.5,$$,37.80048,-122.44014,2240 Chestnut St,San Francisco,CA,US,(415) 638-6022,"[""SO SO GOOD! \nI don't think there is a bad thing on the menu! \nI got the chicken and waffles and it was to die for! The chicken was juicy and seasoned..."", 'C&B original location in Potrero Hill has always been on my radar but I never venture to that part of the city. To my pleasant surprise I found this Marina...', ""Cute and small breakfast spot in the Marina for chicken and waffles! The menu options are quite limited so if you're looking for something OTHER than fried...""]"
If5hVcf5uRbuq4pKXdyOjA,Mr Banh Mi,https://s3-media2.fl.yelpcdn.com/bphoto/GAHvkKzXDFanUoi4egqyng/o.jpg,https://www.yelp.com/biz/mr-banh-mi-san-francisco-2?adjust_creative=Sb39Q_neG8ncCfDxiJ2TWw&utm_campaign=yelp_api_v3&utm_medium=api_v3_business_search&utm_source=Sb39Q_neG8ncCfDxiJ2TWw,350,Vietnamese,4.5,$,37.77558184,-122.4975753,3605 Balboa St,San Francisco,CA,US,(415) 463-6588,"['Top quality viet sandwich, stuffed generously to the brim with ingredients that make you want to keep chowing down.\n\nOrdered the dac biet (special) which...', 'I went here with my brother who was visiting. We wanted to grab something quick before going to Golden Gate Park.\n\nI had the pork belly banh mi - it was so...', 'Very good banh mi! This place is perfect to grab a bite to eat and go on your way. I got my food within 5-10 and that includes waiting in line to order. The...']"
Pp7aw9Vl_TOtdUyNHrv83Q,Vive La Tarte,https://s3-media2.fl.yelpcdn.com/bphoto/wCb4ygygcMlvjoe_j-5LSg/o.jpg,https://www.yelp.com/biz/vive-la-tarte-san-francisco-5?adjust_creative=Sb39Q_neG8ncCfDxiJ2TWw&utm_campaign=yelp_api_v3&utm_medium=api_v3_business_search&utm_source=Sb39Q_neG8ncCfDxiJ2TWw,104,Bakeries,4.5,$$,37.75163,-122.43261,4026 24th St,San Francisco,CA,US,(415) 780-5818,"['The coffee is awesome and elegant, the service is friendly and welcoming and the bake goods are so yummy and high quality. \nI love the newest coffee spot in...', ""Review of service, not food.\n\nFix your kitchen order system so I'm not waiting 20 minutes for an avocado toast. Unless, it's the kitchen staff that..."", 'I was visiting Noe Valley and looking to get coffee and the options immediately in Noe Valley are rather limited. When I saw that Vive La Tarte had a coffee...']"
hqQoVK0vadOX7_4gN1sh3g,Saigon Sandwich,https://s3-media3.fl.yelpcdn.com/bphoto/lE_HHijKAKt08JIeRHVh7w/o.jpg,https://www.yelp.com/biz/saigon-sandwich-san-francisco?adjust_creative=Sb39Q_neG8ncCfDxiJ2TWw&utm_campaign=yelp_api_v3&utm_medium=api_v3_business_search&utm_source=Sb39Q_neG8ncCfDxiJ2TWw,3512,Vietnamese,4.5,$,37.78315196,-122.417318,560 Larkin St,San Francisco,CA,US,(415) 474-5698,"[""I've been to this place for years, and I still like the Vietnamese sandwiches they make since I'm Vietnamese."", 'Authentic banh mi sandwiches at a $5-$6 price point- Saigon Sandwich does it and does it well indeed.\n\nBy way of recommendation, we made Saigon Sandwich a...', ""Cash only. Parking can be tough and sketchy if you're leaving your car there for a long area. You can call ahead for pick-up, but you still need to wait in...""]"
bJ3InsZr5tDlfI6mEV4Pyg,Hidden Spot - SoMa,https://s3-media1.fl.yelpcdn.com/bphoto/2UYI3LymL4zWPPWkFyeVsw/o.jpg,https://www.yelp.com/biz/hidden-spot-soma-san-francisco?adjust_creative=Sb39Q_neG8ncCfDxiJ2TWw&utm_campaign=yelp_api_v3&utm_medium=api_v3_business_search&utm_source=Sb39Q_neG8ncCfDxiJ2TWw,50,Burgers,5,$$,37.77616,-122.40833,1123 Folsom St,San Francisco,CA,US,(415) 813-6041,"[""I looooooove spicy fried chicken sandwiches and I'm so glad this spot is inside Trademark! I order the Firefighter spicy chicken sandwich here at least once..."", ""This place was somewhat of a challenge to find but the entrance is at the corner from a bar (forgot the name on the outside). \nYou'll see a sign for hidden..."", 'It really is a Hidden Spot, located in a normal bar on Folsom. Once you walk in, you can order at a counter towards the back of the bar.\n\nAs for the...']"
WnQoN1uV65vacUj0q1TgoQ,Volcano,https://s3-media3.fl.yelpcdn.com/bphoto/mhYGCdduzVslyuq-ZTsbEA/o.jpg,https://www.yelp.com/biz/volcano-san-francisco?adjust_creative=Sb39Q_neG8ncCfDxiJ2TWw&utm_campaign=yelp_api_v3&utm_medium=api_v3_business_search&utm_source=Sb39Q_neG8ncCfDxiJ2TWw,1295,Japanese Curry,4,$$,37.78067,-122.47802,5454 Geary Blvd,San Francisco,CA,US,(415) 752-7671,"['My absolute favorite Japanese curry spot in SF. Such comforting and flavor some food. Casual spot. You order at the register, sit at whatever table is...', 'This place great.  I had the fried fish (they use the same panko  crust) with medium spicy curry sauce and it was perfect.  I also added eggplant and...', '** Extremely reliable, low-key spot for some tasty Japanese Curry without breaking the bank. Would highly recommend for a to-go meal or a casual bite.\n\nThe...']"
UdRV_X0aah6c2_LLbB8dGg,Yama-chan,https://s3-media1.fl.yelpcdn.com/bphoto/uvgmmk4LDybM7DF7O5sU8A/o.jpg,https://www.yelp.com/biz/yama-chan-san-francisco?adjust_creative=Sb39Q_neG8ncCfDxiJ2TWw&utm_campaign=yelp_api_v3&utm_medium=api_v3_business_search&utm_source=Sb39Q_neG8ncCfDxiJ2TWw,172,Japanese,4,$,37.7850838,-122.4305619,1737 Post St,San Francisco,CA,US,,"[""Freshly made takoyaki stall in the bottom floor of Japantown. It's right next to Mochill  Mochi Donut if you are looking at Uber eats.\n\n\nWhen it first..."", ""Grabbing a bite of takoyaki in Yama-Chan during the afternoon for a quick bite snack. I know this isn't considered a lunch spot just because this place just..."", ""While exploring Japantown, it's a must to eat takoyaki as a snack in between perusing all of the surrounding specialty stores. \n\nThere's a deal where you...""]"
sIQrmyQiydU2UkByK3IeBA,Handroll Project,https://s3-media1.fl.yelpcdn.com/bphoto/6WYpXiHggXXK68gPt_el7Q/o.jpg,https://www.yelp.com/biz/handroll-project-san-francisco-2?adjust_creative=Sb39Q_neG8ncCfDxiJ2TWw&utm_campaign=yelp_api_v3&utm_medium=api_v3_business_search&utm_source=Sb39Q_neG8ncCfDxiJ2TWw,53,Sushi Bars,4.5,$$$$,37.76167,-122.42409,598 Guerrero St,San Francisco,CA,US,,"[""I've been WAITING for a hand-roll bar in SF. Run by the team from Ju-Ni (Michelin-starred omakase restaurant), my expectations heading into the hand-roll..."", 'All ingredients were super fresh and savory, not too salty but just the right amount of flavors.\nI was getting really really tired of dishes in SF being too...', 'Really enjoyed my visit to Handroll Project, decided to go with the 10 piece set so that I could enjoy the specials as well. I saw some gripes that some...']"
q1Mv7oQSOorl4a9zbtl-rQ,Marugame Udon,https://s3-media3.fl.yelpcdn.com/bphoto/BQxRHkBkV1yCRgufMMPUsw/o.jpg,https://www.yelp.com/biz/marugame-udon-san-francisco-4?adjust_creative=Sb39Q_neG8ncCfDxiJ2TWw&utm_campaign=yelp_api_v3&utm_medium=api_v3_business_search&utm_source=Sb39Q_neG8ncCfDxiJ2TWw,2154,Japanese,4,$$,37.727494,-122.476531,3251 20th Ave,San Francisco,CA,US,(415) 680-1280,"['Delicious food! Udon was perfect texture! Had the beef udon and tonkatsu. Both were delicious', 'I came around 6:45 PM on a Friday, and the wait was about 15 minutes. Once I reached the counter where you start ordering, I got my food fairly quickly....', ""loved the udon noodles, broth was okay. I ordered tonkotsu and extra noodles for  2 dollars. Id say don't do that , it's to much. I also had the white fish,...""]"
BI40rGhpngLNPacrjWpseQ,Dumpling Kitchen,https://s3-media1.fl.yelpcdn.com/bphoto/rggI1HG_kaABtAGNiuqF9Q/o.jpg,https://www.yelp.com/biz/dumpling-kitchen-san-francisco?adjust_creative=Sb39Q_neG8ncCfDxiJ2TWw&utm_campaign=yelp_api_v3&utm_medium=api_v3_business_search&utm_source=Sb39Q_neG8ncCfDxiJ2TWw,1897,Chinese,4,$$,37.7423,-122.48701,1935 Taraval St,San Francisco,CA,US,(415) 682-8938,"[""We where visiting from Arizona, at home we don't have lots of places that do serve vegan dumplings and buns. This place is very welcoming. Food is so good..."", ""Came here yesterday after a haircut. The spicy wonton in chili oil was my least favorite because the sauce wasn't very special. However, the wontons were..."", 'Bit of a wait on a late Sunday afternoon, but good thing we joined the Yelp waitlist. I was excited for the food as the menu and pictures looked good, but...']"
EcSIjxiaZ36vqCKAJ9ihIw,Rong's,https://s3-media3.fl.yelpcdn.com/bphoto/7bTl0_7cEt1NoEq61_Txdg/o.jpg,https://www.yelp.com/biz/rongs-san-francisco?adjust_creative=Sb39Q_neG8ncCfDxiJ2TWw&utm_campaign=yelp_api_v3&utm_medium=api_v3_business_search&utm_source=Sb39Q_neG8ncCfDxiJ2TWw,277,Cantonese,4.5,$$,37.77603,-122.49559,3420 Balboa St,San Francisco,CA,US,(415) 702-9918,"['Came at 11:30 AM on a Sunday. It was difficult finding parking but we got lucky and got a spot right outside the restaurant. There were no other guests in...', ""Rong's had been on my list of places to try since I had initially planned my San Fran trip in 2020. Even though it underwent a name change since then, it..."", ""3.5 stars\n\nNot a spot I'd go out if your way for but it's a cute neighborhood restaurant in Outer Sunset. It used to be Jiangnan Cuisine, but with the...""]"
kFgjHGp-cTUK5uPaSJOORA,Souvla,https://s3-media1.fl.yelpcdn.com/bphoto/Gg_ynaIhzIdfTxKXTQmfUA/o.jpg,https://www.yelp.com/biz/souvla-san-francisco?adjust_creative=Sb39Q_neG8ncCfDxiJ2TWw&utm_campaign=yelp_api_v3&utm_medium=api_v3_business_search&utm_source=Sb39Q_neG8ncCfDxiJ2TWw,1602,Greek,4,$$,37.77643,-122.425,517 Hayes St,San Francisco,CA,US,(415) 400-5458,"[""If you're ever in San Fransisco, then you have to try this place!\n\nI ordered the chicken salad which was filled with flavor. They gave a generous portion of..."", 'A ton of people recommended Souvla to me, and I was really excited because one of the best things to ever grace my tastebuds was a Greek yogurt I tried in...', ""FYI: They don't have any trash cans laying out and about (at least when we went) so if you want to throw away your finished yogurt cup, ask the staff member...""]"
055dTcfz2AOAFPed_2KjEQ,Nopalito,https://s3-media1.fl.yelpcdn.com/bphoto/3xz1SUH2huhqPTJtcX7F1A/o.jpg,https://www.yelp.com/biz/nopalito-san-francisco?adjust_creative=Sb39Q_neG8ncCfDxiJ2TWw&utm_campaign=yelp_api_v3&utm_medium=api_v3_business_search&utm_source=Sb39Q_neG8ncCfDxiJ2TWw,1969,Mexican,4,$$,37.7734353,-122.438993,306 Broderick St,San Francisco,CA,US,(415) 437-0303,"['Tamale (5/5) - I barely remember inhaling this, but I thought it was very good.\nChicken mole (3.5/5) - the portions for this were very generous, and the...', 'Curtido served w/ carnitas as well as the salsa verde were on point. Carnitas were tasty as usual. The best thing though, were the tortillas. Last 3 times,...', 'Nopalito was pretty good. We came for dinner on a Saturday night and were seated right away without a reservation. You scan the QR code at your table, and...']"
L0Kanq9vtkYaId7dguEOsQ,Automat,https://s3-media1.fl.yelpcdn.com/bphoto/WLrzb8-Q5HQ722_BqP7vlg/o.jpg,https://www.yelp.com/biz/automat-san-francisco-2?adjust_creative=Sb39Q_neG8ncCfDxiJ2TWw&utm_campaign=yelp_api_v3&utm_medium=api_v3_business_search&utm_source=Sb39Q_neG8ncCfDxiJ2TWw,136,Bakeries,4,$$,37.77719,-122.44193,1801 McAllister St,San Francisco,CA,US,(415) 296-6680,"['Our second visit to Automat was just as good as the first, if not better!\n\nI stuck with the Smoked Trout Toast (which was delicious), but my boyfriend...', 'Highly recommend this spot! They serve delicious pastry and plenty of seatings. Located on the quieter end of Fell street. Great spot to work :) \n\nPlenty of...', 'Stopped by for lunch on a Weds. just before noon. Popular and busy. Easy friendly service. After you order and pay you get a number and take it to your...']"
rMuLW1qVB-deU5NStYerWA,Sushirrito,https://s3-media3.fl.yelpcdn.com/bphoto/8BHpDoqgqMtZCwx6uFtrVw/o.jpg,https://www.yelp.com/biz/sushirrito-san-francisco-55?adjust_creative=Sb39Q_neG8ncCfDxiJ2TWw&utm_campaign=yelp_api_v3&utm_medium=api_v3_business_search&utm_source=Sb39Q_neG8ncCfDxiJ2TWw,1582,Japanese,4,$$,37.79019,-122.40366,226 Kearny St,San Francisco,CA,US,(415) 544-9868,"['Sushiritto is one of, if not my most, frequented spot to grab dinner on the go after work. Generous portions, consistently prepared, and fun flavor...', 'Since the Sansome street one has been closed and I want sushirrito so badly, I came to this store.  \n\nIt was a small shop and I was shocked that ALL staff...', ""Location on Kearny is convenient and easy to get to, except if you're driving and looking for parking.\n\nWent here at 7pm on a Tuesday. No one in line. I...""]"
7rUZnmRVyCpq4TrB9Brsiw,The Little Chihuahua,https://s3-media2.fl.yelpcdn.com/bphoto/_4g8U57l3c3C57pc7PkViw/o.jpg,https://www.yelp.com/biz/the-little-chihuahua-san-francisco?adjust_creative=Sb39Q_neG8ncCfDxiJ2TWw&utm_campaign=yelp_api_v3&utm_medium=api_v3_business_search&utm_source=Sb39Q_neG8ncCfDxiJ2TWw,1555,Mexican,4,$$,37.7720399,-122.43688,292 Divisadero St,San Francisco,CA,US,(415) 255-8225,"['If I could give this place more than 5 stars I would! I have tried their amazingly spiced soyrizo, salmon, plantain and bean tacos, burrito bowls, burritos...', ""I didn't hate the salad as I'm a sucker for corn and avocado in salads. The chipotle dressing also had the perfect amount of spice. \n\nMore so sad about the..."", 'Had lunch catered by employer. 3 locations and they emphasize the use of organic and healthy ingredients.\n\nGot the chicken burrito that comes with beans,...']"
53hTeeM2L5NTEIL_D_HH8Q,The Butcher Shop by Niku Steakhouse,https://s3-media2.fl.yelpcdn.com/bphoto/9Z_Ppt7RMLqKoDKg7OrrNw/o.jpg,https://www.yelp.com/biz/the-butcher-shop-by-niku-steakhouse-san-francisco?adjust_creative=Sb39Q_neG8ncCfDxiJ2TWw&utm_campaign=yelp_api_v3&utm_medium=api_v3_business_search&utm_source=Sb39Q_neG8ncCfDxiJ2TWw,196,Butcher,4.5,$$$,37.7694943,-122.402886,57 Division St,San Francisco,CA,US,(415) 829-2306,"['Was looking for some picana to slap on the grill with less than 5 hours before having to grill them up and this place hit the spot with their meat. We were...', ""The butcher shop servers 2 kinds of burgers and wagyu fat-cooked fries for lunch. They don't have any seating inside so you should be prepared to take your..."", ""As the name implies, this butcher shop is a standalone outlet affiliated with Michelin-starred Niku Steakhouse next door.\n\nHere, you'll find beautiful...""]"
pKTR6gCF6_84ftXVLIGrzA,Parkside Cafe,https://s3-media4.fl.yelpcdn.com/bphoto/mQolzAeLoRRliElaXFEziw/o.jpg,https://www.yelp.com/biz/parkside-cafe-stinson-beach?adjust_creative=Sb39Q_neG8ncCfDxiJ2TWw&utm_campaign=yelp_api_v3&utm_medium=api_v3_business_search&utm_source=Sb39Q_neG8ncCfDxiJ2TWw,772,American (Traditional),3,$$,37.89766992,-122.6397601,43 Arenal Ave,Stinson Beach,CA,US,(415) 868-1272,"[""After reading all the reviews, I had mixed feelings, but was pleasantly surprised.\nYes, they don't have WiFi in the restaurant  but in the bakery area. No..."", 'Two stars primarily for the quick courteous service, cleanliness, and pizza with sourdough crust was yummy. Of course the convenience factor of a sit down...', 'This review is for the sit down restaurant. After a long hike, my friend and I were ravenous and wanted to sit down and rest our legs. Unfortunately,...']"
z4g4bZPR-Z8bFlwv9APl2w,Presidio Kebab,https://s3-media2.fl.yelpcdn.com/bphoto/O_cZ75VmQNjjHmT2GIRBsg/o.jpg,https://www.yelp.com/biz/presidio-kebab-san-francisco?adjust_creative=Sb39Q_neG8ncCfDxiJ2TWw&utm_campaign=yelp_api_v3&utm_medium=api_v3_business_search&utm_source=Sb39Q_neG8ncCfDxiJ2TWw,240,Mediterranean,4.5,$$,37.7880728,-122.4468073,3277 Sacramento St,San Francisco,CA,US,(415) 947-7163,"['Weary Travelers. As we were headed to a typical food chain restaurant to eat because we were too tired and too hungry to explore. We see this elegant...', 'This place is such a hidden gem.\n\nThe staff were all extremely friendly, even telling me the special of the night was a recipe from his mother (eggplant...', 'I went to Presidio Kebab for Sunday lunch this weekend and I will definitely be going back! Everything we ordered was amazing, the inside of the restaurant...']"
KarMlfJURqPo70kQZ4LzFg,Tarragon Cafe,https://s3-media4.fl.yelpcdn.com/bphoto/lnYmJA9sKbu6DyLMTWV2ZQ/o.jpg,https://www.yelp.com/biz/tarragon-cafe-san-francisco?adjust_creative=Sb39Q_neG8ncCfDxiJ2TWw&utm_campaign=yelp_api_v3&utm_medium=api_v3_business_search&utm_source=Sb39Q_neG8ncCfDxiJ2TWw,64,Cafes,4.5,$$,37.77139,-122.43014,200 Fillmore St,San Francisco,CA,US,(415) 624-3318,"[""Tried this based on a friend's recommendation and it did not disappoint! I'd say I have pretty high salad standards and value high quality ingredients and I..."", ""Tarragon, in Cafe du Soleil's old spot, had a lot to live up to once the took over the space from the dear departed coffee Soleil. \n\nI was hesitant to come..."", ""Beware, if you're planning on coming in here with a service animal, you might be in for a rude awakening.\n\nAfter reading all of the positive Yelp reviews, I...""]"
TK-AfnulnF5yvL5aRFhniA,Diamond Cafe,https://s3-media4.fl.yelpcdn.com/bphoto/fVNOYJxJXTfZy-IdcHnt7Q/o.jpg,https://www.yelp.com/biz/diamond-cafe-san-francisco?adjust_creative=Sb39Q_neG8ncCfDxiJ2TWw&utm_campaign=yelp_api_v3&utm_medium=api_v3_business_search&utm_source=Sb39Q_neG8ncCfDxiJ2TWw,161,Cafes,4.5,$$,37.75128979,-122.4361688,751 Diamond St,San Francisco,CA,US,(415) 655-3674,"['Nice coffee and breakfast shop Limited menu, but what we had was very good. Pea Soup rocked!\n\nThey were very accommodating, always a ""yes-no problem"" with...', ""This is our family go-to for brunch! It's a tried and true, hearty and satisfying place to grab a pastry, a smoothie, a coffee, or go all out with a massive..."", 'This cute small neighborhood cafe provides clean and casual indoors and outdoors sitting spaces. The simple menu on the wall is easy to read and the staff...']"
0mNzmmh1mrdh5Cpg2QUBiw,Lapisara Eatery,https://s3-media4.fl.yelpcdn.com/bphoto/KPAzk-Q-UM5YOdyVyE760A/o.jpg,https://www.yelp.com/biz/lapisara-eatery-san-francisco-2?adjust_creative=Sb39Q_neG8ncCfDxiJ2TWw&utm_campaign=yelp_api_v3&utm_medium=api_v3_business_search&utm_source=Sb39Q_neG8ncCfDxiJ2TWw,1116,Breakfast & Brunch,4.5,$$,37.7878344,-122.4131853,698 Post St,San Francisco,CA,US,(415) 655-3556,"['Showed up in a group of six at 10am on a Friday morning and there was a line already as expected. We were lucky in that we just beat the crowd and were...', 'Our brunch was delicious!! We tried to come for brunch once before, but the line was long so we tried again this weekend and the line moved pretty fast....', 'Ate brunch with friends here on a Saturday! The location is very close to Westfield and Downtown so it is very convenient if you are doing some shopping...']"
imHjAJ9uuUK_PNkzT9kCag,Basa Seafood Express,https://s3-media4.fl.yelpcdn.com/bphoto/SV_BUHgxzaIlWE9aOeS1Cg/o.jpg,https://www.yelp.com/biz/basa-seafood-express-san-francisco?adjust_creative=Sb39Q_neG8ncCfDxiJ2TWw&utm_campaign=yelp_api_v3&utm_medium=api_v3_business_search&utm_source=Sb39Q_neG8ncCfDxiJ2TWw,888,Seafood,4.5,$,37.75276,-122.41338,3064 24th St,San Francisco,CA,US,(415) 550-2388,"['Found this place through tik-tok, as all other food recs lol. Always been a big fan of poke, and so I had to try this place out! I loved it. Their fish...', 'One of the best Poke spots in the Bay. Really good comforting flavor. I got spicy salmon. Tasted a little bit like soy sauce tbh. Spice was not killing me....', 'Quick meal for $13! I got the spicy salmon poke combo; it came with the fish, serving of rice, seaweed salad, and the choice of water or coke. I was...']"
9nltvO9__dkyRIT17D5TqQ,Palm House,https://s3-media3.fl.yelpcdn.com/bphoto/WEhiaYvvbCOpoGPH6rybtQ/o.jpg,https://www.yelp.com/biz/palm-house-san-francisco?adjust_creative=Sb39Q_neG8ncCfDxiJ2TWw&utm_campaign=yelp_api_v3&utm_medium=api_v3_business_search&utm_source=Sb39Q_neG8ncCfDxiJ2TWw,1127,Caribbean,4,$$,37.797772,-122.432887,2032 Union St,San Francisco,CA,US,(415) 749-9959,"['One of my favorite places in the city. During the day, the place is a nice restaurant. Their food portion is big. I love the Cubano and spiced fries. Their...', 'We came here for a birthday party and rented the sun room at the entrance of the building. The minimum was $550 to book the place. We ordered several apps...', 'I went to Palm House today and sat at the bar. My friend and I got drinks and closed out. I live a block away. After I finish my drink at the bar with my...']"
Nty8mxwmbRviQmWUKedhfg,Bay Subs & Deli,https://s3-media3.fl.yelpcdn.com/bphoto/fk398wwoBrIkfig0onfkGg/o.jpg,https://www.yelp.com/biz/bay-subs-and-deli-san-francisco?adjust_creative=Sb39Q_neG8ncCfDxiJ2TWw&utm_campaign=yelp_api_v3&utm_medium=api_v3_business_search&utm_source=Sb39Q_neG8ncCfDxiJ2TWw,196,Sandwiches,4.5,$,37.7900047,-122.4337006,2486 Sacramento St,San Francisco,CA,US,(415) 346-3888,"['I love the crab sandwich! So tasty! And the owner is so nice, and she keeps the place clean and tidy.', 'If you are looking for a solid neighborhood deli, this is the one! I have been frequenting Bay Subs for the last year or so, and really enjoy the quality,...', 'I can always count on a great sandwich here after doctors appointments nearby. I love both the Bay Sub Specials #1 and #2. \nGenerous portions of meat, they...']"
LaMFre26m58W-ZmAHsjEKA,Ocean Indian Cuisine,https://s3-media3.fl.yelpcdn.com/bphoto/lGxDdwyyXEjRty0Ca9C73w/o.jpg,https://www.yelp.com/biz/ocean-indian-cuisine-san-francisco?adjust_creative=Sb39Q_neG8ncCfDxiJ2TWw&utm_campaign=yelp_api_v3&utm_medium=api_v3_business_search&utm_source=Sb39Q_neG8ncCfDxiJ2TWw,222,Indian,5,$$,37.7799,-122.48522,6127 Geary Blvd,San Francisco,CA,US,(415) 751-4433,"['Well-deserved five stars! Service was extremely attentive and the food was incredible. We tried a bit of everything: chicken momos, butter chicken, goat...', 'Was hesitant on ordering, like where do you even find such good reviews. But am I glad that I did . \n\n\nOrdered online and everything ran smoothly, walked in...', 'So delicious! One of the best Indian places in the area :). \n\nThe best thing about this place is that apparently everyone who works there (waiters & servers...']"
eeZIpjDQrVcOOoPfycWf_g,Dumpling Alley,https://s3-media1.fl.yelpcdn.com/bphoto/FxwmqUTmqwncRkf1OoVhhg/o.jpg,https://www.yelp.com/biz/dumpling-alley-san-francisco?adjust_creative=Sb39Q_neG8ncCfDxiJ2TWw&utm_campaign=yelp_api_v3&utm_medium=api_v3_business_search&utm_source=Sb39Q_neG8ncCfDxiJ2TWw,207,Chinese,4,$$,37.782167,-122.486328,2512 Clement St,San Francisco,CA,US,(415) 753-9617,"['YUMMY dumplings, AMAZING beef noodle soup! Average XLB. Decent pan fried pork buns with a crispy sesame bottom. Everything made FRESH and by hand! \n\n5/5...', ""I haven't written a sad review in years but this place had 4 stars?? I feel like I needed to say something so other unsuspecting folks wouldn't be as..."", ""Kinda sad when the best part of your meal at a dumpling restaurant is their salad.\n\nWalked in because of a Chef's Special sign outside the restaurant. Was...""]"
4vqUi0Zrhj6D7nAaMZz-OQ,B on the Go,https://s3-media2.fl.yelpcdn.com/bphoto/HhqnMp1CnBnnSEhs982isQ/o.jpg,https://www.yelp.com/biz/b-on-the-go-san-francisco-4?adjust_creative=Sb39Q_neG8ncCfDxiJ2TWw&utm_campaign=yelp_api_v3&utm_medium=api_v3_business_search&utm_source=Sb39Q_neG8ncCfDxiJ2TWw,210,Cafes,4,$$,37.78828001,-122.4403175,2794 California St,San Francisco,CA,US,(415) 589-7112,"['Perfect weekend spot for to go sandwiches or dine in. Have been here multiple times for a quick breakfast and brunch. They have a great variety of brunch...', 'Not what it used to be. Price still high. Unlikely to come back again. Limited service and energy. Slow service.', 'Came by for lunch the other day and it was a fantastic experience! Street parking in Pac Heights was available. \n\nThe staff working behind the counter were...']"
ZPsuN4ON2TWD1bhuMjyMQQ,Gai Chicken Rice,https://s3-media4.fl.yelpcdn.com/bphoto/DiGUVM8m9X8dyIOwhR6dIQ/o.jpg,https://www.yelp.com/biz/gai-chicken-rice-san-francisco?adjust_creative=Sb39Q_neG8ncCfDxiJ2TWw&utm_campaign=yelp_api_v3&utm_medium=api_v3_business_search&utm_source=Sb39Q_neG8ncCfDxiJ2TWw,337,Thai,4,$$,37.7642,-122.42998,3463 16th St,San Francisco,CA,US,(415) 535-0451,"['Delicious and healthy meal. Great for kids or adults. Fresh chicken over rice made with chicken stock. You get your choice of sauce on the side. It comes...', ""Decently good chicken + rice. After having Nong's Khao Man Gai in Portland, nothing will live up to that bar. But Gai's is probably the best you can get in..."", ""You guys know I give out more 5 stars than poor reviews. I don't like giving bad reviews. It doesn't get me off in any way.\n\nCame in today and asked about...""]"
