ID,Name,Image,Url,Review count,Category,Rating,Price,Latitude,Longitude,Address,City,State,Country,Phone,Review
qEjeEmv0SVU_9NRWGL9EoQ,Seoul Hotdog,https://s3-media4.fl.yelpcdn.com/bphoto/Pu00hUPnpWMH-mgRBoK-DQ/o.jpg,https://www.yelp.com/biz/seoul-hotdog-berkeley?adjust_creative=Sb39Q_neG8ncCfDxiJ2TWw&utm_campaign=yelp_api_v3&utm_medium=api_v3_business_search&utm_source=Sb39Q_neG8ncCfDxiJ2TWw,329,Hot Dogs,4.5,$,37.875441,-122.259764,2505 Hearst Ave,Berkeley,CA,US,(510) 766-8182,"['This is a Korean style hotdog with different types of crusts: original, potato, sweet potato, hot Cheetos, and Ube. Besides hotdog, they also offer...', 'Came here on a Saturday afternoon for a quick snack with my friend. First thing I noticed was how spacious their outdoor seating was. Even though the...', 'What a fun experience. The wait time was not long and the dogs were sweet literally. I ordered the regular  seol dog. I highly recommend. Just a regular dog...']"
4eaK2-Q0dEXWMr5SOoV_Sg,Roam Artisan Burgers,https://s3-media4.fl.yelpcdn.com/bphoto/WWc1dK4hMO6knOQe-y_6yg/o.jpg,https://www.yelp.com/biz/roam-artisan-burgers-san-francisco-3?adjust_creative=Sb39Q_neG8ncCfDxiJ2TWw&utm_campaign=yelp_api_v3&utm_medium=api_v3_business_search&utm_source=Sb39Q_neG8ncCfDxiJ2TWw,1302,Burgers,4,$$,37.787682,-122.433853,1923 Fillmore St,San Francisco,CA,US,(415) 800-7801,"['This place is one of the best burger spots in the city\n\nThese are great:\n-Tejano burger\n-Chalet burger\n\nThe tejano burger was especially good!\n\nSidenote:...', ""Sigh... where do I begin. I've been ordering from Roam for many years because I love their mindful ingredients and delicious food. \n\nHowever, lately, I've..."", 'Walking around looking for something eat around Fillmore district was a fun trip.  \nMost of the places were pizza places or meditaranian. I am not a fan if...']"
iMyA8ZgPZrQjSzhS_T-z9Q,Banh Mi Love,https://s3-media3.fl.yelpcdn.com/bphoto/bcox_GbeZ5T5oLzgeJ7MHw/o.jpg,https://www.yelp.com/biz/banh-mi-love-san-francisco?adjust_creative=Sb39Q_neG8ncCfDxiJ2TWw&utm_campaign=yelp_api_v3&utm_medium=api_v3_business_search&utm_source=Sb39Q_neG8ncCfDxiJ2TWw,75,Vietnamese,4.5,$,37.7301499,-122.4764287,597 Buckingham Way,San Francisco,CA,US,(415) 941-7814,"['After a shift volunteering with the SF Food Bank pop nearby at the YMCA, I was hung-gray!  Thankfully I remembered that I needed to stop by Banh Mi Love for...', 'I really, really, really wanted to love this place. Like I read the reviews the night before and was so excited to try it. I found it inside the business...', ""Holy cow, where's that bonus star??! Cuz Banh Mi Love deserves 6 stars and they have my eternal love, forever and always! I've been skeptical about coming...""]"
iyo3pjuRb7mTpaDwXnAzuQ,Square Pie Guys,https://s3-media2.fl.yelpcdn.com/bphoto/usNRsp7QJryycWl3n5GZgQ/o.jpg,https://www.yelp.com/biz/square-pie-guys-san-francisco?adjust_creative=Sb39Q_neG8ncCfDxiJ2TWw&utm_campaign=yelp_api_v3&utm_medium=api_v3_business_search&utm_source=Sb39Q_neG8ncCfDxiJ2TWw,622,Pizza,4.5,$$,37.779479,-122.4103136,1077 Mission St,San Francisco,CA,US,(415) 872-9290,"[""Hands down the best pizza in all of San Francisco. You really can't go wrong with any of their combinations. Even the salad is good here! \n\nI'm never..."", 'We ordered the vodka sauce pizza with pepperoni and mushroom!\n\nSquare Pie Guys has your very own Detroit style pizza! With lots of options and flavors to...', 'Quality of the pizza did not disappoint. Ordered the Plant Squares 2.0, fries, crispy asparagus, and the monkey bread for pickup when I was in SF for the...']"
eOCVoXsOEnbr9c89RD0UEQ,Pork Store Cafe,https://s3-media1.fl.yelpcdn.com/bphoto/nnAWYrsb8Yh99AuKvjcrEg/o.jpg,https://www.yelp.com/biz/pork-store-cafe-san-francisco?adjust_creative=Sb39Q_neG8ncCfDxiJ2TWw&utm_campaign=yelp_api_v3&utm_medium=api_v3_business_search&utm_source=Sb39Q_neG8ncCfDxiJ2TWw,1416,Breakfast & Brunch,4,$$,37.77000159,-122.4462534,1451 Haight St,San Francisco,CA,US,(415) 864-6981,"['this tall handsome man named Qais was our busser and holy shit, he was incredible. I would give him a seven star review if I could. but now I must comment...', 'Awesome as ever interesting old fashion Diner that is actually quite tasty This place is such a dark hole in the wall but the food is always excellent', 'Cute little diner on Haight across from Piedmont. Tight fit, but clean and neat eccentric place. I tried the biscuits and gravy and got a big plate with...']"
DgfhciOcB9X7SXFFQR7t9w,Blue Barn Gourmet,https://s3-media2.fl.yelpcdn.com/bphoto/ZjE9MSSQS4DPf-6oXPpoBg/o.jpg,https://www.yelp.com/biz/blue-barn-gourmet-san-francisco-2?adjust_creative=Sb39Q_neG8ncCfDxiJ2TWw&utm_campaign=yelp_api_v3&utm_medium=api_v3_business_search&utm_source=Sb39Q_neG8ncCfDxiJ2TWw,581,Salad,4,$$,37.797486,-122.422348,2237 Polk St,San Francisco,CA,US,(415) 655-9438,"[""Quality ingredient sandwich and salad place. Definitely San Francisco prices-you aren't leaving there paying less than $20 for a salad with..."", 'If you like being surprised charged for ranch when they casually ask ""would you like ketchup & ranch for your tots?"" then this place is for you. \n\nAlso a 5%...', ""Ordered the Kickin' Chicken sandwich and the Big Blue sandwich to go.\nWas handed the wrong order at first, which I quickly returned because I saw just one...""]"
EF8WoEUdt-qTZ2P-DLYYNQ,New England Lobster Market & Eatery,https://s3-media3.fl.yelpcdn.com/bphoto/eIEvQKEdybaW7Xx3ZYRsyw/o.jpg,https://www.yelp.com/biz/new-england-lobster-market-and-eatery-burlingame?adjust_creative=Sb39Q_neG8ncCfDxiJ2TWw&utm_campaign=yelp_api_v3&utm_medium=api_v3_business_search&utm_source=Sb39Q_neG8ncCfDxiJ2TWw,4617,Seafood Markets,4.5,$$,37.602687,-122.374733,824 Cowan Rd,Burlingame,CA,US,(650) 443-1559,"['So yummy! Highly recommended raw oysters, raw clams, lobsters, lobster rolls and get frozen lobster bisque soup home. Happy Hour M-F, 3-6pm.', ""Love to have a lobster? For me here it's a good place to go , people are working there is friendly."", 'Found this spot while on vacation on our last night in Cali!! Amazing food and great service. Relaxed vibe. Cool place!!']"
PFk6k_hEGG0n6_FAJSm9EQ,Woodhouse Fish Company,https://s3-media2.fl.yelpcdn.com/bphoto/XL-TVILiiZBtBqutAhF_wg/o.jpg,https://www.yelp.com/biz/woodhouse-fish-company-san-francisco-4?adjust_creative=Sb39Q_neG8ncCfDxiJ2TWw&utm_campaign=yelp_api_v3&utm_medium=api_v3_business_search&utm_source=Sb39Q_neG8ncCfDxiJ2TWw,2438,Seafood,4,$$,37.78742,-122.43327,1914 Fillmore St,San Francisco,CA,US,(415) 437-2722,"[""Seafood classics served up fresh! We stumbled up Woodhouse Fish Co. and we were pleasantly surprised. The inside is not too big and there's only a hand full..."", 'More seafood? Yes please!\n-- -- --\n  Yet another yummy friends Friday this week. We went to Woodhouse Fish Co. for early dinner and after busy week, it was...', 'Love the vibe here! And food is delicious. My fav fish and chips have been from Hook in Mill Valley but finally found a spot in SF that I like as much or...']"
sp4Axlo-ddvYpl8xUeUsVw,Lime Tree Southeast Asian Kitchen,https://s3-media3.fl.yelpcdn.com/bphoto/sixpztiauhiE-6MRbXTxHQ/o.jpg,https://www.yelp.com/biz/lime-tree-southeast-asian-kitchen-san-francisco?adjust_creative=Sb39Q_neG8ncCfDxiJ2TWw&utm_campaign=yelp_api_v3&utm_medium=api_v3_business_search&utm_source=Sb39Q_neG8ncCfDxiJ2TWw,1545,Malaysian,4,$$,37.764337,-122.462736,450 Irving St,San Francisco,CA,US,(415) 665-1415,"[""They still exist! Affordable hole-in-the-wall places that serve up good food. Don't expect a fancy interior or a pampering service: you order food, have fun..."", ""Another good restaurant in Sunset! Went around 6pm on a Thursday. When I walked in, I felt like I was at home- reminded me of my parents' kitchen. There was..."", 'I really enjoyed my food here. The food was delicious and the service was great. The beef Rendang was delicious along with the garlic noodles. The roti was...']"
UbKrcsBaZoaBkBOajEX08g,Brenda's Meat & Three,https://s3-media2.fl.yelpcdn.com/bphoto/lGTNI53PmuMr5ViIFVVuBQ/o.jpg,https://www.yelp.com/biz/brendas-meat-and-three-san-francisco-3?adjust_creative=Sb39Q_neG8ncCfDxiJ2TWw&utm_campaign=yelp_api_v3&utm_medium=api_v3_business_search&utm_source=Sb39Q_neG8ncCfDxiJ2TWw,1342,Breakfast & Brunch,4,$$,37.77814892,-122.4385513,919 Divisadero St,San Francisco,CA,US,(415) 926-8657,"['Made same day reservations for a late lunch as hubs craving fried chicken. This time we also took the kiddos. \n\nWe arrived a little early for our...', ""Super Bummer. I've been here sporadically throughout their time. It's been a few years so i thought it would be fun to go again.\n\nTook a guest here who is..."", 'Went here for a quick dinner with friends! Almost wasnt seated bec we had no reservations, but luckily, the guy at the bar moved a seat so that me and my...']"
JPL5OqxmoKGWXZxVSlYkag,Yo Yo's,https://s3-media4.fl.yelpcdn.com/bphoto/lNNiQesx7SjCpvu_njjmvg/o.jpg,https://www.yelp.com/biz/yo-yos-san-francisco?adjust_creative=Sb39Q_neG8ncCfDxiJ2TWw&utm_campaign=yelp_api_v3&utm_medium=api_v3_business_search&utm_source=Sb39Q_neG8ncCfDxiJ2TWw,593,Japanese,4.5,$,37.79770254,-122.4012355,318 Pacific Ave,San Francisco,CA,US,(415) 296-8273,"['One of the few remaining ultra-affordable gems in SF!\nAnd tasty for the price.\nIt is easy to make killer food and give 5 stars with price of $40\n     like...', 'This is the most wholesome and heartwarming lunch option in FiDi. (And also probably the most budget friendly!) Yo-yos has a limited but amazing selection...', ""Update from my previous post.\n\nIf you're looking for good food on a budget, this is the place for you.\n\nBUDGET FRIENDLY \nFor those who are budget conscious,...""]"
7tsN9N9mhfJRNTe37pLFMg,Burma Love,https://s3-media3.fl.yelpcdn.com/bphoto/Sd_ij4_9TyALdoNgwnzmaw/o.jpg,https://www.yelp.com/biz/burma-love-san-francisco-10?adjust_creative=Sb39Q_neG8ncCfDxiJ2TWw&utm_campaign=yelp_api_v3&utm_medium=api_v3_business_search&utm_source=Sb39Q_neG8ncCfDxiJ2TWw,1468,Burmese,4,$$,37.76961,-122.42205,211 Valencia St,San Francisco,CA,US,(415) 861-2100,"['Yea leaf salad is goated. I love Burma love. I love Burma love. The minced chicken and lamb curry GOATED eat here pretty please.', 'Ordered takeout today and loved the food, not the prices though :S\n\nFood ordered: Garlic eggplant, mint chicken for my partner, platha, and brown rice. The...', 'Excellent. We got the lamb, both salads, pitcher of beer, and the rounds crispy chicken balls. Regrettably no photos this time. \n\nMake reservations!']"
kwjLNSEFX2m1Am5gZdL6GA,Rooster & Rice,https://s3-media2.fl.yelpcdn.com/bphoto/GEFycZj8pB5tVpvOfNtsBQ/o.jpg,https://www.yelp.com/biz/rooster-and-rice-san-francisco-18?adjust_creative=Sb39Q_neG8ncCfDxiJ2TWw&utm_campaign=yelp_api_v3&utm_medium=api_v3_business_search&utm_source=Sb39Q_neG8ncCfDxiJ2TWw,58,Chicken Shop,4,$$,37.76085,-122.43365,4039 18th St,San Francisco,CA,US,(415) 346-9700,"[""Really love Rooster & Rice's sauce and broth, but there's a lot of other competitors who serve similar foods for far cheaper. Rooster and Rice's previous..."", ""Rooster & Rice was recommended to my boyf and Yelper, Dario O., so during our trip to the city, we decided to check this place out.\n\nStreet parking wasn't..."", ""I come here often for the popcorn chicken.  It's just the right size and comes with habanero hot sauce.  The sauce is perfect - just the right amount of...""]"
zetzVfO4X0dpiiTmjdeKg,Eiji,https://s3-media1.fl.yelpcdn.com/bphoto/pWiRTXc0Te7loPLVRRBhwQ/o.jpg,https://www.yelp.com/biz/eiji-san-francisco?adjust_creative=Sb39Q_neG8ncCfDxiJ2TWw&utm_campaign=yelp_api_v3&utm_medium=api_v3_business_search&utm_source=Sb39Q_neG8ncCfDxiJ2TWw,1119,Sushi Bars,4,$$,37.764058,-122.430685,317 Sanchez St,San Francisco,CA,US,(415) 558-8149,"[""I love writing updated reviews for places I originally visited 7 years ago. That was the case for Eiji, which I've been to countless times starting in 2015...."", 'Favorite down-to-earth Japanese spot in town. (Should be 4.5 stars.) We usually order a number of dishes, which are always great, but we come for the house,...', ""It's more of a 4.3/5. I love the food that I got today but I didn't try a lot of things.\n- Warm homemade tofu with the starchy sauce, a tiny bit of ginger,...""]"
yhFQSw02txaZwx2mzOqzAg,Breakers Café,https://s3-media3.fl.yelpcdn.com/bphoto/Y7SU3ujo-J0bLyMF7ejFjg/o.jpg,https://www.yelp.com/biz/breakers-caf%C3%A9-stinson-beach-3?adjust_creative=Sb39Q_neG8ncCfDxiJ2TWw&utm_campaign=yelp_api_v3&utm_medium=api_v3_business_search&utm_source=Sb39Q_neG8ncCfDxiJ2TWw,245,Breakfast & Brunch,3.5,$$,37.8983,-122.63916,3465 Hwy 1,Stinson Beach,CA,US,(415) 868-2002,"['We stopped here for lunch on a weekend day after our long walk on the beach. It was a great meal! There were a lot of people ordering and so we were...', 'Fries-5 stars\nPortion size - 5 stars\nValue - 5 stars\nCoffee - 5 stars\nCleanliness - 5 stars\nService - 1 star.  \nHad a nice post hike lunch and the guy at...', 'Right in the middle of this cute seaside town. Perfect stop before you hit the waters. \nWe stopped at lunch time. The parking is scarce. We drive a loop...']"
bMCss-xNW2DRnC4QH2Y_gw,Yummy Dumpling,https://s3-media3.fl.yelpcdn.com/bphoto/IIMUDOQzTm4TgJFZkyjbfw/o.jpg,https://www.yelp.com/biz/yummy-dumpling-san-francisco?adjust_creative=Sb39Q_neG8ncCfDxiJ2TWw&utm_campaign=yelp_api_v3&utm_medium=api_v3_business_search&utm_source=Sb39Q_neG8ncCfDxiJ2TWw,174,Do-It-Yourself Food,4.5,$,37.7637346,-122.4761766,1708 Irving St,San Francisco,CA,US,(415) 753-9308,"['Yummy Dumpling has just what their name says: yummy dumplings (they also have other goodies that are just as yummy, though. So technically, more than what...', 'Delicious!!\n\nThe take home dumplings are next level\n\nSuper easy to cook as well\n\nWill be back', 'I make it a point to buy a coolers worth of hand made frozen dumpling to bring back to central California every time I visit SF. Great flavor and hand made...']"
e3gcKXKhSFYs5fn9FoeG2A,KoJa Kitchen,https://s3-media2.fl.yelpcdn.com/bphoto/JGt_d4fr2IeUOBURXPKuzQ/o.jpg,https://www.yelp.com/biz/koja-kitchen-san-francisco-7?adjust_creative=Sb39Q_neG8ncCfDxiJ2TWw&utm_campaign=yelp_api_v3&utm_medium=api_v3_business_search&utm_source=Sb39Q_neG8ncCfDxiJ2TWw,675,Japanese,4,$$,37.78287002,-122.4630963,343 Clement St,San Francisco,CA,US,(415) 463-5085,"['I never write reviews but I had a really good experience yesterday, so I will document it!\n\nfood review: Koja is literally 10/10. I always get the chicken...', ""Yum, love this place. It always hits the spot when I'm looking for a nourishing, healthyish bowl - grains, protein, greens that are full of flavor \n\nThe..."", '3.5 ... to be fair. Not a takedown, just a a shame.\n\nConsistency is off these days. Which is important with things that rely on crispiness.\n\nPerhaps because...']"
tjflPf7MTPmSgau-b8CN3A,WesBurger 'N' More,https://s3-media1.fl.yelpcdn.com/bphoto/c3kfueXWqy6T2DeWNRmCaQ/o.jpg,https://www.yelp.com/biz/wesburger-n-more-san-francisco?adjust_creative=Sb39Q_neG8ncCfDxiJ2TWw&utm_campaign=yelp_api_v3&utm_medium=api_v3_business_search&utm_source=Sb39Q_neG8ncCfDxiJ2TWw,696,Burgers,4,$$,37.76119859,-122.4195013,2240 Mission St,San Francisco,CA,US,(415) 745-9371,"['Holy moley was this good! I ordered delivery from Uber Eats. I was craving a fried chicken sandwich and Uber was offering a 40% off coupon.\n\nThe food came...', 'The food was disappointing, greasy, and overpriced. The breading used on the fried chicken is too thick and overly done. The buns looked and felt oily; they...', 'The Nashville Hot Chicken sandwich was incredible, juicy and crispy. The tater tots were the dream experience. So incredible. If I had to explain why humans...']"
jRbLvmBGRuNQwsZdV_LWyA,RT Rotisserie,https://s3-media3.fl.yelpcdn.com/bphoto/1dHBStZcMChNm9lQDGLn5w/o.jpg,https://www.yelp.com/biz/rt-rotisserie-san-francisco-2?adjust_creative=Sb39Q_neG8ncCfDxiJ2TWw&utm_campaign=yelp_api_v3&utm_medium=api_v3_business_search&utm_source=Sb39Q_neG8ncCfDxiJ2TWw,125,Bars,4,$$,37.773141,-122.438884,302 Broderick St,San Francisco,CA,US,,"['Health, affordable and tastes great.\n\nThe rice bowl was perfect for me with chipotle yogurt as my sauce. The fries were crisp and flavourful. The lemonade...', ""A favorite of our household, this Rich Table spinoff delivers on its esteemed family name. \n\nOrder at the counter: anything you pick can't go wrong. Some of..."", 'This was a nice spot to have a quick lunch with a friend. Food was well flavored and service was quick. There was ample seating inside and outside. It was...']"
DGyoVB9PdI9_jw0CNi_OPg,Suppenküche,https://s3-media4.fl.yelpcdn.com/bphoto/HAumhGEjTcqstgie00Fjag/o.jpg,https://www.yelp.com/biz/suppenk%C3%BCche-san-francisco-2?adjust_creative=Sb39Q_neG8ncCfDxiJ2TWw&utm_campaign=yelp_api_v3&utm_medium=api_v3_business_search&utm_source=Sb39Q_neG8ncCfDxiJ2TWw,3248,German,4,$$,37.77626038,-122.4263916,525 Laguna St,San Francisco,CA,US,(415) 252-9289,"['Had the chance to visit Suppenkuche which is located in Hayes Valley, and so glad we did! This was an awesome experience from start to finish with great...', ""For so many years Suppnkuche has been providing amazing energy . It's not about food and beers only , it's about culture as well .\nNot so easy to..."", 'Ordered the following for takeout through Grubhub: Wiener schnitzel, jagerschnitzel, sautéed trout, potato pancakes, sausage platter (2 wild boar, jalapeño...']"
XhJ6ZYagcWNHpJ1H1KvNlQ,a Mano,https://s3-media4.fl.yelpcdn.com/bphoto/ezG_zJwov2QNZwyK14EkwA/o.jpg,https://www.yelp.com/biz/a-mano-san-francisco-2?adjust_creative=Sb39Q_neG8ncCfDxiJ2TWw&utm_campaign=yelp_api_v3&utm_medium=api_v3_business_search&utm_source=Sb39Q_neG8ncCfDxiJ2TWw,1324,Italian,4,$$,37.77696388,-122.4238685,450 Hayes St,San Francisco,CA,US,(415) 506-7401,"[""Our bartender was lovely. I don't recall his name but he had glasses and was serving us Tuesday night. Just great service and a great experience."", ""After running the San Francisco Marathon, I was craving a pizza.\n\nIt's pretty hard to get lunch foods delivered early in the day, but a Mano was on point! I..."", 'Always busy, and for good reason! a Mano is cute, tasty, and quite affordable by SF standards. We arrived on a Friday night at 7:30 after being on the Yelp...']"
DGyoVB9PdI9_jw0CNi_OPg,Suppenküche,https://s3-media4.fl.yelpcdn.com/bphoto/HAumhGEjTcqstgie00Fjag/o.jpg,https://www.yelp.com/biz/suppenk%C3%BCche-san-francisco-2?adjust_creative=Sb39Q_neG8ncCfDxiJ2TWw&utm_campaign=yelp_api_v3&utm_medium=api_v3_business_search&utm_source=Sb39Q_neG8ncCfDxiJ2TWw,3248,German,4,$$,37.77626038,-122.4263916,525 Laguna St,San Francisco,CA,US,(415) 252-9289,"['Had the chance to visit Suppenkuche which is located in Hayes Valley, and so glad we did! This was an awesome experience from start to finish with great...', ""For so many years Suppnkuche has been providing amazing energy . It's not about food and beers only , it's about culture as well .\nNot so easy to..."", 'Ordered the following for takeout through Grubhub: Wiener schnitzel, jagerschnitzel, sautéed trout, potato pancakes, sausage platter (2 wild boar, jalapeño...']"
XhJ6ZYagcWNHpJ1H1KvNlQ,a Mano,https://s3-media4.fl.yelpcdn.com/bphoto/ezG_zJwov2QNZwyK14EkwA/o.jpg,https://www.yelp.com/biz/a-mano-san-francisco-2?adjust_creative=Sb39Q_neG8ncCfDxiJ2TWw&utm_campaign=yelp_api_v3&utm_medium=api_v3_business_search&utm_source=Sb39Q_neG8ncCfDxiJ2TWw,1324,Italian,4,$$,37.77696388,-122.4238685,450 Hayes St,San Francisco,CA,US,(415) 506-7401,"[""Our bartender was lovely. I don't recall his name but he had glasses and was serving us Tuesday night. Just great service and a great experience."", ""After running the San Francisco Marathon, I was craving a pizza.\n\nIt's pretty hard to get lunch foods delivered early in the day, but a Mano was on point! I..."", 'Always busy, and for good reason! a Mano is cute, tasty, and quite affordable by SF standards. We arrived on a Friday night at 7:30 after being on the Yelp...']"
bUr4iq2mKKiBOu2HKynylg,HRD,https://s3-media1.fl.yelpcdn.com/bphoto/G05B7mvYPHBpGu1wP1NK_Q/o.jpg,https://www.yelp.com/biz/hrd-san-francisco-4?adjust_creative=Sb39Q_neG8ncCfDxiJ2TWw&utm_campaign=yelp_api_v3&utm_medium=api_v3_business_search&utm_source=Sb39Q_neG8ncCfDxiJ2TWw,2525,Asian Fusion,4,$$,37.78110658,-122.3953297,521A 3rd St,San Francisco,CA,US,(415) 543-2355,"['This place is solid for Asian fusion food! They have Asian inspired proteins including panko-crusted shrimp, wild cod katsu, tuna poke, and bulgogi beef....', 'We to HRD for a quick lunch, after looking at the different reviews and getting excited for a unique burrito! Once there you basically order and get a...', 'Great fusion cuisine coffee shop!!! I just love it.\nWhat I always come for is the Kimchi Burrito, Korean/Mexican meal on the go, simply genius.\nTotally...']"
qz-bbCkEehvg6SkgahAwVQ,Vixi,https://s3-media1.fl.yelpcdn.com/bphoto/0W0BYh9lYkkU7dFSpD8-7A/o.jpg,https://www.yelp.com/biz/vixi-san-francisco-2?adjust_creative=Sb39Q_neG8ncCfDxiJ2TWw&utm_campaign=yelp_api_v3&utm_medium=api_v3_business_search&utm_source=Sb39Q_neG8ncCfDxiJ2TWw,242,Italian,4,$$,37.786136,-122.4536699,3611 California St,San Francisco,CA,US,(415) 842-4921,"['Great service and love the chicken Marsala. Found recently and tried almost the whole menu. Which I may say is very simple and classic items. Dined in and...', ""This is the only nice restaurant on the California Avenue section of Laurel Heights.  My apologies in advance to Super Duper and Panda Express.\n\nIt's a good..."", 'My first time here for Italian food and I was so impressed by the quality and the taste of the food. My friends loved what they ordered and I enjoyed...']"
GyBh5QsGham__kK7eJ2feQ,Box Kitchen,https://s3-media2.fl.yelpcdn.com/bphoto/lgec94Phd30Dr7sGafXMXg/o.jpg,https://www.yelp.com/biz/box-kitchen-san-francisco?adjust_creative=Sb39Q_neG8ncCfDxiJ2TWw&utm_campaign=yelp_api_v3&utm_medium=api_v3_business_search&utm_source=Sb39Q_neG8ncCfDxiJ2TWw,822,Food Stands,4.5,$$,37.78119117,-122.4063123,431 Natoma St,San Francisco,CA,US,(415) 580-7170,"['This dive bar has unexpected, excellent food at a reasonable price. Definitely worth checking out!', ""Visited San Francisco on vacation and this was the first and last place we ate. Just took a chance based on the reviews and wasn't disappointed. My daughter..."", 'Decent food. The music selection is meh and they can stand to turn it down about 6db so you can actually have a conversation. I have had an easy time...']"
d4IcZGC-gvms4f45oXor8A,Ramenwell,https://s3-media1.fl.yelpcdn.com/bphoto/oNTSkYNL2FHmfXRaAxZ1zA/o.jpg,https://www.yelp.com/biz/ramenwell-san-francisco-5?adjust_creative=Sb39Q_neG8ncCfDxiJ2TWw&utm_campaign=yelp_api_v3&utm_medium=api_v3_business_search&utm_source=Sb39Q_neG8ncCfDxiJ2TWw,286,Ramen,4,$$,37.76197203,-122.4188568,3378 18th St,San Francisco,CA,US,(415) 589-7680,"[""I got here sharp at 11:30 am on Sunday, skipped any crowds, and focused on the ramen.\n\nThey didn't skimp effort in developing a fantastic bowl of ramen..."", 'I was excited to try this place because it is in my neighborhood. My dad loves ramen so we gave it a shot.\n\nThe staff was friendly. It was empty lunch time....', 'Not sure how this got on my bookmarks list, but it was. Was in the area and wanted some noods for dinner, so decided to come here. A really odd system as I...']"
jRbLvmBGRuNQwsZdV_LWyA,RT Rotisserie,https://s3-media3.fl.yelpcdn.com/bphoto/1dHBStZcMChNm9lQDGLn5w/o.jpg,https://www.yelp.com/biz/rt-rotisserie-san-francisco-2?adjust_creative=Sb39Q_neG8ncCfDxiJ2TWw&utm_campaign=yelp_api_v3&utm_medium=api_v3_business_search&utm_source=Sb39Q_neG8ncCfDxiJ2TWw,125,Bars,4,$$,37.773141,-122.438884,302 Broderick St,San Francisco,CA,US,,"['Health, affordable and tastes great.\n\nThe rice bowl was perfect for me with chipotle yogurt as my sauce. The fries were crisp and flavourful. The lemonade...', ""A favorite of our household, this Rich Table spinoff delivers on its esteemed family name. \n\nOrder at the counter: anything you pick can't go wrong. Some of..."", 'This was a nice spot to have a quick lunch with a friend. Food was well flavored and service was quick. There was ample seating inside and outside. It was...']"
Qv-yh5vmrN7mss3BNsqhQg,Onigilly - San Francisco,https://s3-media2.fl.yelpcdn.com/bphoto/56ViGKt1zeVo0IaFNMTqbg/o.jpg,https://www.yelp.com/biz/onigilly-san-francisco-san-francisco?adjust_creative=Sb39Q_neG8ncCfDxiJ2TWw&utm_campaign=yelp_api_v3&utm_medium=api_v3_business_search&utm_source=Sb39Q_neG8ncCfDxiJ2TWw,561,Japanese,4,$$,37.7914033,-122.404308,343 Kearny St,San Francisco,CA,US,(415) 671-4706,"['Surprised by the quick service!\n\nI ordered on the iPad and my food came out within 5 minutes during the lunchtime rush. They had a great assembly line that...', 'Day and Time: Tuesday @1:30 pm\nI walked in during the ""lunch rush."" Tons of FiDi professionals walking around so I was expect i g a bit of a wait when I saw...', ""I've seen signage that Valley Fair Mall is getting an Onigilly shop, so when I happened past this location on my way back from some errands, I decided to...""]"
